,News_Name,Date_Year
0,The Button is Coming,"January 25, 2021 at 12:25 PM"
1,The Season 11 Crystal League Championship,"January 22, 2021 at 11:43 AM"
2,The Frost Challenge Returns,"January 1, 2021 at 9:54 AM"
3,2020: Albion's Year in Review,"December 31, 2020 at 9:43 AM"
4,Sandbox Interactive joins Stillfront,"December 18, 2020 at 9:48 AM"
5,Dev Talk: Year-End Update,"December 17, 2020 at 9:53 AM"
6,Uncle Frost is Back - and a Fame Boost is Coming,"December 16, 2020 at 9:39 AM"
7,New Vanity Skins are Here,"December 10, 2020 at 9:46 AM"
8,Season 11 Starts Saturday,"December 3, 2020 at 9:47 AM"
9,Rise of Avalon Patch 10 is Here,"December 2, 2020 at 9:51 AM"
10,Streamer Snapshot: Kokosmilch,"January 18, 2021 at 11:27 AM"
11,Guild Spotlight: ROLL BACK,"January 14, 2021 at 10:37 AM"
12,Watch Invasion Day Live on AlbionTV,"January 1, 2021 at 11:30 AM"
13,Guild Spotlight: Głupio Wyszło,"December 15, 2020 at 8:26 AM"
14,Guild Spotlight: Mercenary Company,"December 7, 2020 at 4:17 PM"
